{
  "schemaVersion": 1,
  "id": "wall_champ_03",
  "dimensions": {
    "width": 5.0,
    "height": 8.0,
    "depth": 0.25
  },
  "transform": {
    "position": [
      0,
      4.0,
      0
    ],
    "rotationEuler": [
      0,
      0,
      0
    ]
  },
  "bounds": {
    "minX": -2.3,
    "maxX": 2.3,
    "minY": 0.15,
    "maxY": 7.85
  },
  "holds": [
    {
      "id": "start_l",
      "type": "start",
      "position": [
        -0.4,
        2.1,
        -0.18
      ],
      "radius": 0.12,
      "allowedLimbs": [
        "hand_l"
      ],
      "maxOccupants": 2
    },
    {
      "id": "start_r",
      "type": "start",
      "position": [
        0.4,
        2.1,
        -0.18
      ],
      "radius": 0.12,
      "allowedLimbs": [
        "hand_r"
      ],
      "maxOccupants": 2
    },
    {
      "id": "fa",
      "type": "foot",
      "position": [
        -0.52,
        0.72,
        -0.18
      ],
      "radius": 0.11,
      "allowedLimbs": [
        "foot_l",
        "foot_r"
      ],
      "maxOccupants": 1
    },
    {
      "id": "fb",
      "type": "foot",
      "position": [
        0.52,
        0.76,
        -0.18
      ],
      "radius": 0.11,
      "allowedLimbs": [
        "foot_l",
        "foot_r"
      ],
      "maxOccupants": 1
    },
    {
      "id": "h1",
      "type": "standard",
      "position": [
        0.2,
        2.02,
        -0.18
      ],
      "radius": 0.12,
      "allowedLimbs": [
        "hand_l",
        "hand_r",
        "foot_l",
        "foot_r"
      ],
      "maxOccupants": 2
    },
    {
      "id": "h3",
      "type": "standard",
      "position": [
        0.35,
        2.74,
        -0.18
      ],
      "radius": 0.12,
      "allowedLimbs": [
        "hand_l",
        "hand_r",
        "foot_l",
        "foot_r"
      ],
      "maxOccupants": 2
    },
    {
      "id": "h5",
      "type": "standard",
      "position": [
        0.5,
        3.46,
        -0.18
      ],
      "radius": 0.12,
      "allowedLimbs": [
        "hand_l",
        "hand_r",
        "foot_l",
        "foot_r"
      ],
      "maxOccupants": 2
    },
    {
      "id": "h7",
      "type": "standard",
      "position": [
        0.65,
        4.18,
        -0.18
      ],
      "radius": 0.12,
      "allowedLimbs": [
        "hand_l",
        "hand_r",
        "foot_l",
        "foot_r"
      ],
      "maxOccupants": 2
    },
    {
      "id": "h9",
      "type": "standard",
      "position": [
        0.8,
        4.9,
        -0.18
      ],
      "radius": 0.12,
      "allowedLimbs": [
        "hand_l",
        "hand_r",
        "foot_l",
        "foot_r"
      ],
      "maxOccupants": 2
    },
    {
      "id": "h11",
      "type": "standard",
      "position": [
        0.52,
        5.62,
        -0.18
      ],
      "radius": 0.12,
      "allowedLimbs": [
        "hand_l",
        "hand_r",
        "foot_l",
        "foot_r"
      ],
      "maxOccupants": 2
    },
    {
      "id": "h13",
      "type": "standard",
      "position": [
        0.3,
        6.34,
        -0.18
      ],
      "radius": 0.12,
      "allowedLimbs": [
        "hand_l",
        "hand_r",
        "foot_l",
        "foot_r"
      ],
      "maxOccupants": 2
    },
    {
      "id": "h2",
      "type": "standard",
      "position": [
        -0.24,
        2.38,
        -0.18
      ],
      "radius": 0.12,
      "allowedLimbs": [
        "hand_l",
        "hand_r",
        "foot_l",
        "foot_r"
      ],
      "maxOccupants": 2
    },
    {
      "id": "h4",
      "type": "standard",
      "position": [
        -0.08,
        3.1,
        -0.18
      ],
      "radius": 0.12,
      "allowedLimbs": [
        "hand_l",
        "hand_r",
        "foot_l",
        "foot_r"
      ],
      "maxOccupants": 2
    },
    {
      "id": "h6",
      "type": "standard",
      "position": [
        0.08,
        3.82,
        -0.18
      ],
      "radius": 0.12,
      "allowedLimbs": [
        "hand_l",
        "hand_r",
        "foot_l",
        "foot_r"
      ],
      "maxOccupants": 2
    },
    {
      "id": "h8",
      "type": "standard",
      "position": [
        0.24,
        4.54,
        -0.18
      ],
      "radius": 0.12,
      "allowedLimbs": [
        "hand_l",
        "hand_r",
        "foot_l",
        "foot_r"
      ],
      "maxOccupants": 2
    },
    {
      "id": "h10",
      "type": "standard",
      "position": [
        0.34,
        5.26,
        -0.18
      ],
      "radius": 0.12,
      "allowedLimbs": [
        "hand_l",
        "hand_r",
        "foot_l",
        "foot_r"
      ],
      "maxOccupants": 2
    },
    {
      "id": "h12",
      "type": "standard",
      "position": [
        0.2,
        5.98,
        -0.18
      ],
      "radius": 0.12,
      "allowedLimbs": [
        "hand_l",
        "hand_r",
        "foot_l",
        "foot_r"
      ],
      "maxOccupants": 2
    },
    {
      "id": "h14",
      "type": "standard",
      "position": [
        0.04,
        6.7,
        -0.18
      ],
      "radius": 0.12,
      "allowedLimbs": [
        "hand_l",
        "hand_r",
        "foot_l",
        "foot_r"
      ],
      "maxOccupants": 2
    },
    {
      "id": "top",
      "type": "top",
      "position": [
        0.0,
        6.9,
        -0.18
      ],
      "radius": 0.17,
      "allowedLimbs": [
        "hand_l",
        "hand_r"
      ],
      "maxOccupants": 2
    },
    {
      "id": "fb2",
      "type": "foot",
      "position": [
        0.52,
        1.72,
        -0.18
      ],
      "radius": 0.11,
      "allowedLimbs": [
        "foot_l",
        "foot_r"
      ],
      "maxOccupants": 1
    },
    {
      "id": "fa2",
      "type": "foot",
      "position": [
        -0.46,
        1.62,
        -0.18
      ],
      "radius": 0.11,
      "allowedLimbs": [
        "foot_l",
        "foot_r"
      ],
      "maxOccupants": 1
    },
    {
      "id": "fb3",
      "type": "foot",
      "position": [
        0.5,
        2.44,
        -0.18
      ],
      "radius": 0.11,
      "allowedLimbs": [
        "foot_l",
        "foot_r"
      ],
      "maxOccupants": 1
    },
    {
      "id": "fa3",
      "type": "foot",
      "position": [
        -0.42,
        2.34,
        -0.18
      ],
      "radius": 0.11,
      "allowedLimbs": [
        "foot_l",
        "foot_r"
      ],
      "maxOccupants": 1
    },
    {
      "id": "fb4",
      "type": "foot",
      "position": [
        0.46,
        3.16,
        -0.18
      ],
      "radius": 0.11,
      "allowedLimbs": [
        "foot_l",
        "foot_r"
      ],
      "maxOccupants": 1
    },
    {
      "id": "fa4",
      "type": "foot",
      "position": [
        -0.38,
        3.06,
        -0.18
      ],
      "radius": 0.11,
      "allowedLimbs": [
        "foot_l",
        "foot_r"
      ],
      "maxOccupants": 1
    },
    {
      "id": "fb5",
      "type": "foot",
      "position": [
        0.42,
        3.88,
        -0.18
      ],
      "radius": 0.11,
      "allowedLimbs": [
        "foot_l",
        "foot_r"
      ],
      "maxOccupants": 1
    },
    {
      "id": "fa5",
      "type": "foot",
      "position": [
        -0.36,
        3.78,
        -0.18
      ],
      "radius": 0.11,
      "allowedLimbs": [
        "foot_l",
        "foot_r"
      ],
      "maxOccupants": 1
    },
    {
      "id": "fb6",
      "type": "foot",
      "position": [
        0.4,
        4.6,
        -0.18
      ],
      "radius": 0.11,
      "allowedLimbs": [
        "foot_l",
        "foot_r"
      ],
      "maxOccupants": 1
    },
    {
      "id": "fa6",
      "type": "foot",
      "position": [
        -0.34,
        4.5,
        -0.18
      ],
      "radius": 0.11,
      "allowedLimbs": [
        "foot_l",
        "foot_r"
      ],
      "maxOccupants": 1
    },
    {
      "id": "fb7",
      "type": "foot",
      "position": [
        0.38,
        5.32,
        -0.18
      ],
      "radius": 0.11,
      "allowedLimbs": [
        "foot_l",
        "foot_r"
      ],
      "maxOccupants": 1
    },
    {
      "id": "fa7",
      "type": "foot",
      "position": [
        -0.32,
        5.22,
        -0.18
      ],
      "radius": 0.11,
      "allowedLimbs": [
        "foot_l",
        "foot_r"
      ],
      "maxOccupants": 1
    },
    {
      "id": "fb8",
      "type": "foot",
      "position": [
        0.36,
        6.04,
        -0.18
      ],
      "radius": 0.11,
      "allowedLimbs": [
        "foot_l",
        "foot_r"
      ],
      "maxOccupants": 1
    },
    {
      "id": "fa8",
      "type": "foot",
      "position": [
        -0.3,
        5.94,
        -0.18
      ],
      "radius": 0.11,
      "allowedLimbs": [
        "foot_l",
        "foot_r"
      ],
      "maxOccupants": 1
    }
  ],
  "collisionProfile": "climbing_wall_default",
  "presentation": {
    "mesh": "walls/prototype/wall.glb"
  }
}