{
  "schemaVersion": 1,
  "id": "wall_basic_01",
  "dimensions": {
    "width": 5.0,
    "height": 5.0,
    "depth": 0.25
  },
  "transform": {
    "position": [
      0,
      2.5,
      0
    ],
    "rotationEuler": [
      0,
      0,
      0
    ]
  },
  "bounds": {
    "minX": -2.3,
    "maxX": 2.3,
    "minY": 0.15,
    "maxY": 4.85
  },
  "holds": [
    {
      "id": "start_l",
      "type": "start",
      "position": [
        -0.42,
        2.1,
        -0.18
      ],
      "radius": 0.14,
      "allowedLimbs": [
        "hand_l"
      ],
      "maxOccupants": 2
    },
    {
      "id": "start_r",
      "type": "start",
      "position": [
        0.42,
        2.1,
        -0.18
      ],
      "radius": 0.14,
      "allowedLimbs": [
        "hand_r"
      ],
      "maxOccupants": 2
    },
    {
      "id": "foot_jug_l",
      "type": "foot",
      "position": [
        -0.62,
        0.72,
        -0.18
      ],
      "radius": 0.13,
      "allowedLimbs": [
        "foot_l",
        "foot_r"
      ],
      "maxOccupants": 1
    },
    {
      "id": "foot_jug_r",
      "type": "foot",
      "position": [
        0.62,
        0.72,
        -0.18
      ],
      "radius": 0.13,
      "allowedLimbs": [
        "foot_l",
        "foot_r"
      ],
      "maxOccupants": 1
    },
    {
      "id": "foot_mid_l",
      "type": "foot",
      "position": [
        -0.58,
        1.75,
        -0.18
      ],
      "radius": 0.13,
      "allowedLimbs": [
        "foot_l",
        "foot_r"
      ],
      "maxOccupants": 1
    },
    {
      "id": "foot_mid_r",
      "type": "foot",
      "position": [
        0.58,
        2.2,
        -0.18
      ],
      "radius": 0.13,
      "allowedLimbs": [
        "foot_l",
        "foot_r"
      ],
      "maxOccupants": 1
    },
    {
      "id": "mid_l",
      "type": "standard",
      "position": [
        -0.36,
        2.98,
        -0.18
      ],
      "radius": 0.14,
      "allowedLimbs": [
        "hand_l",
        "hand_r",
        "foot_l",
        "foot_r"
      ],
      "maxOccupants": 2
    },
    {
      "id": "mid_r",
      "type": "standard",
      "position": [
        0.22,
        2.98,
        -0.18
      ],
      "radius": 0.14,
      "allowedLimbs": [
        "hand_l",
        "hand_r",
        "foot_l",
        "foot_r"
      ],
      "maxOccupants": 2
    },
    {
      "id": "r1",
      "type": "standard",
      "position": [
        -0.18,
        1.62,
        -0.18
      ],
      "radius": 0.14,
      "allowedLimbs": [
        "hand_l",
        "hand_r",
        "foot_l",
        "foot_r"
      ],
      "maxOccupants": 2
    },
    {
      "id": "r2",
      "type": "standard",
      "position": [
        0.34,
        1.98,
        -0.18
      ],
      "radius": 0.14,
      "allowedLimbs": [
        "hand_l",
        "hand_r",
        "foot_l",
        "foot_r"
      ],
      "maxOccupants": 2
    },
    {
      "id": "r3",
      "type": "standard",
      "position": [
        -0.4,
        2.38,
        -0.18
      ],
      "radius": 0.14,
      "allowedLimbs": [
        "hand_l",
        "hand_r",
        "foot_l",
        "foot_r"
      ],
      "maxOccupants": 2
    },
    {
      "id": "r4",
      "type": "standard",
      "position": [
        0.1,
        2.78,
        -0.18
      ],
      "radius": 0.14,
      "allowedLimbs": [
        "hand_l",
        "hand_r",
        "foot_l",
        "foot_r"
      ],
      "maxOccupants": 2
    },
    {
      "id": "r5",
      "type": "standard",
      "position": [
        -0.34,
        3.18,
        -0.18
      ],
      "radius": 0.14,
      "allowedLimbs": [
        "hand_l",
        "hand_r",
        "foot_l",
        "foot_r"
      ],
      "maxOccupants": 2
    },
    {
      "id": "r6",
      "type": "standard",
      "position": [
        0.36,
        3.52,
        -0.18
      ],
      "radius": 0.14,
      "allowedLimbs": [
        "hand_l",
        "hand_r",
        "foot_l",
        "foot_r"
      ],
      "maxOccupants": 2
    },
    {
      "id": "r7",
      "type": "standard",
      "position": [
        -0.06,
        3.92,
        -0.18
      ],
      "radius": 0.14,
      "allowedLimbs": [
        "hand_l",
        "hand_r",
        "foot_l",
        "foot_r"
      ],
      "maxOccupants": 2
    },
    {
      "id": "r8",
      "type": "standard",
      "position": [
        0.3,
        4.26,
        -0.18
      ],
      "radius": 0.14,
      "allowedLimbs": [
        "hand_l",
        "hand_r",
        "foot_l",
        "foot_r"
      ],
      "maxOccupants": 2
    },
    {
      "id": "top",
      "type": "top",
      "position": [
        0,
        4.58,
        -0.18
      ],
      "radius": 0.18,
      "allowedLimbs": [
        "hand_l",
        "hand_r"
      ],
      "maxOccupants": 2
    }
  ],
  "collisionProfile": "climbing_wall_default",
  "presentation": {
    "mesh": "walls/prototype/wall.glb"
  }
}